"The story of the Nike x Tom Sachs Poncho is a reminder that good solutions take time to solidify. The product’s simplicity is deceiving. Its shapeshifting nature was perfected over the course of four years, dozens of prototypes, countless tests and innumerable hacks."
"The poncho began life in 2015 as one output of a design challenge to consider transforming apparel, and was undertaken by Jarrett Reynolds, Nike's senior design director for apparel special projects, and others. Reynolds was initially intrigued by the idea of a slimline pack complete with a quick-deploy poncho that pulled swiftly from its carry and could be easily repacked after use."
"""We used a tear-away zipper for the first incarnation. It allowed for the explosion — the forceful billowing that allowed the wearer to quickly get into the poncho — but it was really difficult to set up,"" says Reynolds."
"A collection of prototypes, including one made shortly after Sachs had an ""ah-ha"" moment on December 24, 2017."
"Despite its finicky nature, this prototype led to eight or nine other concepts, over the course of two years, each helping show proof of concept but never quite clicking, so Reynolds shared the poncho via video to a frequent Nike collaborator, Tom Sachs."
"“He was like, ‘We've got to do something with this.’ I was stoked because Tom and his team are problem-solvers, they look at things from a different perspective than we do and that’s what we needed,” says Reynolds. From there, the project blossomed into a collaborative, inventive exercise with the artist.  "
"In conversation, Sachs discusses how the poncho went from speculative exercise to NIKECRAFT project."
<strong>Nike News: NIKECRAFT is a 50-50 enterprise between Nike and Tom Sachs. How does that work when it comes to this product? </strong>
Nike News: NIKECRAFT is a 50-50 enterprise between Nike and Tom Sachs. How does that work when it comes to this product? 
<br/>
"
Tom Sachs: I want to start by reminding all of us that NIKECRAFT isn't just a brand, it's a philosophy and an approach to how we do stuff based on transparency and evidence of construction."
"Jarrett showed me the idea and expressed the problems with it — he said that it was too complicated. And I said, ‘No problem. We'll just make a movie about it.’ In doing that, we discovered it was as complicated as Jarrett suggested, so we began to work on different solutions."
"Through a lot of exploration and testing, the studio was able to find opportunity to push on an idea that had been stuck. We simplified the deployment mechanism and the repacking mechanism. We integrated things like a drag-racing inspired parachute release mechanism, an extension flap to the poncho and the fanny pack. "
"<strong>NN: When someone shows you something like Jarrett had with the breakaway zippers and this vague construct, where does your mind go? How did you get to drag racing?</strong>"
"NN: When someone shows you something like Jarrett had with the breakaway zippers and this vague construct, where does your mind go? How did you get to drag racing?"
<br/>
"
TS: When I saw his first prototype, I viewed it as a magic trick. Later, when I stumbled across the parachute release mechanism of a dragster and saw how it folded back, I saw how the problems that we were having with the complexity of the release mechanism were solved in other parts of industry. This particular mechanism, which allows a transition from fast to slow, served the purpose we needed.  "
"These transitions are reflected in the season of springtime, and March is the puberty of the seasons. And it's a very difficult month, statistically it’s when most people lose their cell phones and their keys and their wallet because they're switching coats. Also, as you get caught in the rain during this time but rarely have a raincoat with you, I thought,"
<em> why not combine all these problems?</em>
 why not combine all these problems?
" One thing that we’ve learned in the studio is that if you have a bunch of problems, sometimes adding more problems to the pile can start to solve the problems."
<strong>NN: The collection also includes down shorts. Why do we need those?</strong>
NN: The collection also includes down shorts. Why do we need those?
<br/>
"
TS: When I'm working in the studio — that's my athletic arena — when I wear shorts, I'm much more limber, I'm faster and I think better because I'm not constrained by fabric resistance in my knees."
<strong>NN: All of the pieces also have ceramic embellishments produced by the Sachs studio. How do you think about your own studio as part of this multi-faceted manufacturing process?</strong>
NN: All of the pieces also have ceramic embellishments produced by the Sachs studio. How do you think about your own studio as part of this multi-faceted manufacturing process?
<br/>
"
TS: One of the greatest parts about working with Nike is being able to build things on a scale that the studio can never produce."
"I made some of these ceramic beads for other projects and I thought, "
"<em>well, they're pretty quick to make, </em>"
"well, they're pretty quick to make, "
"and I thought,"
"<em> wouldn't it be great if we could make one small part of the final product, and make many thousands?</em>"
" wouldn't it be great if we could make one small part of the final product, and make many thousands?"
"We set up a little factory of beadmaking and we fired 16,000 of them that are hand formed, drilled, marked with a Swoosh and a Tom Sachs logo. And you can see the fingerprints of individuals who made them on the pieces."
"<strong>NN: Of course, other hands are involved in the process of making the pieces in the collection too. The poncho calls out Vietnam specifically. How important is the factory relationship with the collaboration of NIKECRAFT?</strong>"
"NN: Of course, other hands are involved in the process of making the pieces in the collection too. The poncho calls out Vietnam specifically. How important is the factory relationship with the collaboration of NIKECRAFT?"
<br/>
"
TS: The factory we worked with in Vietnam is, really, one the best makers that I've worked with at Nike. They didn't just blindly do what they were told. And that's a true measure of a real collaboration. Together, we all worked to produce the product, and in the spirit of transparency, I think it's really worth talking about the individuals who make the things."
Channeling all this into a finished NIKECRAFT product requires a healthy push-pull. Transparency 
<em>is</em>
is
" critical, as is sharing the underpinnings of how things work. The ingenuity of the thinking is solidified with a NIKECRAFT first: The poncho’s mechanics are patent pending."
"The poncho, which is the highlight of the NIKECRAFT Transitions collection (inclusive of the Mars Yard Overshoe and the previously mentioned down short), incorporates materials ranging from Dyneema®️ (the same super-strong fiber used on the Mars Yard Overshoe) for the trinity case behind the poncho, to those ceramic beads created by Sachs’ studio. A Fidlock buckle ensures ease of use for the waist strap, and the poncho itself was prepared from a three-layer waterproof and breathable fabric that allowed for minimal size with maximum coverage. Bold printing on the back of the garment proudly announces the location of manufacture: Vietnam."
"“The ideas in this collection — transparency of materials and of construction — are very well reflected, and I'm really honored by this body of work. They have the same value and integrity of the sculptures that I make in the studio,” says Sachs."
"And, while the products certainly could be displayed, Sachs believes strongly that they should not only be used, but also serve as an impetus to dig in and learn more. More about doing, about imagining and, above all, about process."
"The apparel elements of the NIKECRAFT Transitions collection launch April 27 in Japan to coincide with Sachs' ""Tea Ceremony"" exhibition at Tokyo Opera City Art Gallery. A global release will follow. "
"Update February 8, 2020: Apparel from the NIKECRAFT Transitions collection is available globally February 15. The assortment includes the Nike x Tom Sachs Poncho, down shorts in black and white, cap and both long and short sleeved T-shirts. "
.........................................................
Nike has partnered with five international icons of style to create new expressions of sport in time for the world’s biggest sporting event this summer in Japan.
"Sport-inspired collections from Yoon Ahn of AMBUSH©, Jun Takahashi of Undercover, Chitose Abe of sacai, Matthew Williams of ALYX and Virgil Abloh’s Off-White each celebrate the unique ways sport manifests. The designers equally express the inherent style of athletes and athletic apparel, and individually, each approaches the theme from different points on the sporting spectrum."
"Collectively, the initiative signifies the unifying value of sport as spark of imagination, possibility and vibrancy. Whether touching on the edges of sport culture, the rebellious spirit of barrier-breaking, the formation of new archetypes, the cutting edge of sports science research or the exuberance of fandom, all lanes combine in honor of intentional movement."
The full collections will release this summer. 
.........................................................
"For the Nike x Off-White Training Collection, Virgil Abloh energizes one of Nike’s signature sport performance apparel lines, Nike Pro, with a youthful, graphic aesthetic that borrows from the designer’s trademark visual language."
<br/>
"
 "
<br/>
"
Nike and Off-White logo-marks and graffiti-inspired graphics embellish the product, which carries the same stark yellow and black color palette from Abloh’s previous running collection, """
"<a class=""text--link"" href=""https://news.nike.com/news/nike-virgil-abloh-athlete-in-progress-terra-kiger-official-release-info"" target=""_blank"">Athlete in Progress</a>"
Athlete in Progress
","" and celebrates the ongoing pursuit of athletic excellence that Nike champions."
"Through the uniform color and graphic visual identity, the collection also seeks to connect to the nostalgia of official-issue sports apparel often associated with youth and team sports — for many the first “exclusive” pieces ever owned."
"And because training covers all manner of sporting activity, together these elements create a uniform for fans of all sport, creating an emotional exuberance that galvanizes sports and training enthusiasts of all kinds."
The Nike x Off-White Training Collection releases February 6.
.........................................................
The Jordan Chicago Collaborators' Collection uses the eight colors of the Chicago transit line to inspire city-specific takes on footwear and apparel.
The Jordan Chicago Collaborators' Collection for NBA All-Star 2020 serves as a canvas for the Chicago creative community to represent their neighborhoods through footwear and apparel. Each collaborative partner used specific transit line colors to enliven their ideas and reimagine what Jordan Brand’s UNITE rallying cry means to them and to the city of Chicago.
"<strong>The Jordan Cody Hudson Chicago Collaborators' Collection (Orange): Cody Hudson hoodie, Cody Hudson long-sleeve tee</strong>"
"The Jordan Cody Hudson Chicago Collaborators' Collection (Orange): Cody Hudson hoodie, Cody Hudson long-sleeve tee"
"Hudson — painter, sculptor and Creative Director at Land and Sea Dept. — uses his fascination with motion-inspired graphics to inform his hoodie and long-sleeve tee, reimagining the six-point star from the Chicago flag under the UNITE message."
"<strong>The Jordan Drew the Barber Chicago Collaborators' Collection (Brown): Drew The Barber hoodie, Drew The Barber long-sleeve tee</strong>"
"The Jordan Drew the Barber Chicago Collaborators' Collection (Brown): Drew The Barber hoodie, Drew The Barber long-sleeve tee"
"Drew the Barber from Chicago’s No Cuts, No Glory, wants to give confidence to anyone who sits in his chair, from NBA players to the city’s youth. His designs, inspired by old Chicago transit tokens, draws from 1988 and also reflects his belief in the power of a great look."
"<strong>The Jordan Lyrical Lemonade Chicago Collaborators' Collection (Pink): Jordan Aerospace 720 UC, Lyrical Lemonade hoodie, Lyrical Lemonade long-sleeve tee</strong>"
"The Jordan Lyrical Lemonade Chicago Collaborators' Collection (Pink): Jordan Aerospace 720 UC, Lyrical Lemonade hoodie, Lyrical Lemonade long-sleeve tee"
"Lyrical Lemonade began in 2013 through the vision of music video director Cole Bennett and partner Jake ""JB"" Brode and theorized as a platform to highlight Chicago’s young musical talent. His Jordan Aerospace 720 has a reflective upper that includes all transit colors on the heel tab, shaped in the form of the brand’s lemonade carton logo."
"<strong>The Jordan Sheila Rashid Chicago Collaborators' Collection (Purple): Women’s Air Jordan I Mid SE UC, Sheila Rashid hoodie, Sheila Rashid long-sleeve tee</strong>"
"The Jordan Sheila Rashid Chicago Collaborators' Collection (Purple): Women’s Air Jordan I Mid SE UC, Sheila Rashid hoodie, Sheila Rashid long-sleeve tee"
"The unisex brand from Sheila Rashid, one of Chicago’s most talented young designers, aims to confront gender identity stereotypes. Her Air Jordan I includes cool grey and field purple with toe box color blocking, while her signature is featured on the tongue. The sockliner, with the same color blocking as the shoe, places her logo on the left and UNITE branding on the right. The photos on the apparel were taken personally by Rashid."
"<strong>The Jordan SocialWorks Chicago Collaborators' Collection (Blue): Air Jordan I Hi KO UC, SocialWorks hoodie, SocialWorks long-sleeve tee</strong>"
"The Jordan SocialWorks Chicago Collaborators' Collection (Blue): Air Jordan I Hi KO UC, SocialWorks hoodie, SocialWorks long-sleeve tee"
"Cofounded by Chance the Rapper, SocialWorks aims to empower youth through the arts, education and civic engagement while fostering leadership within Chicago through entrepreneurial opportunity. To illustrate the spirit of Unite, the apparel and footwear feature hands of different colors joined together. A compass logo on the apparel wears off with time, symbolizing the wisdom gained from a lifetime spent in the city, and showing that, if you’ve walked these streets before, you no longer need a map."
"<strong>The Jordan SucceZZ Chicago Collaborators' Collection (Yellow): SucceZZ hoodie, SucceZZ long-sleeve tee</strong>"
"The Jordan SucceZZ Chicago Collaborators' Collection (Yellow): SucceZZ hoodie, SucceZZ long-sleeve tee"
"Founded in 2008 and co-owned by Lavelle Sykes and Bobby Simmons, the Chicago streetwear boutique SucceZZ uses apparel pieces to recreate art seen on the Yellow Line, inspired by the phrase, “No Place Like Home.”"
"<strong>The Jordan Virgil Abloh Chicago Collaborators' Collection (Red): Air Jordan V Retro SP, Virgil woven jacket, Virgil pant, Virgil short-sleeve tee, Virgil hoodie, Virgil boiler suit</strong>"
"The Jordan Virgil Abloh Chicago Collaborators' Collection (Red): Air Jordan V Retro SP, Virgil woven jacket, Virgil pant, Virgil short-sleeve tee, Virgil hoodie, Virgil boiler suit"
"Virgil Abloh, the creative mind behind Off-White, interprets a capsule of Jordan Brand apparel pieces through his one-of-a-kind cultural perspective."
"<strong>The Jordan Wings Chicago Collaborators' Collection (Green): Air Jordan X Retro Wings, Wings hoodie, Wings long-sleeve tee</strong>"
"The Jordan Wings Chicago Collaborators' Collection (Green): Air Jordan X Retro Wings, Wings hoodie, Wings long-sleeve tee"
"The AJ X and apparel were designed by four local students from each participating Wings organization: Embarc, Enlace, Link Unlimited and Little Black Pearl. Featuring all eight colors of Chicago’s transit line, the shoe was inspired by varying definitions of grit and durability."
The full Jordan Brand 8x8 collection releases globally February 15.
.........................................................
The latest Nike x Pigalle Collection 
"Since 2014, Nike has worked with Parisian Stéphane Ashpool’s Pigalle in a mutual celebration of basketball’s pure cultural impact. The collaboration has generated a series of apparel and footwear collections, and also focused on supporting community-building programming by providing safe harbor for players. "
"In September 2019, an initial court in Paris became a hub for the city's players and an international symbol for the game's creative impulses. In 2019, Ashpool and Nike aim to bring the Pigalle perspective on safe sport spaces to new cities."
The Nike x Pigalle basketball court in Beijing
"""Our court in Paris birthed a community,"" says Ashpool. ""We transformed a parking lot into a place that has fostered a family and inspired people. All the subtle details that can make this magic happen were united. It was the best learning for me, and now it’s the right time to work in expanding this scheme, staying organic, authentic and focused."""
"A second Pigalle court also opened in Beijing, China in fall 2019. The location is testament to China's fervor for basketball, and the need to provide a place that can become part of the community fabric. ""The importance of the project is to give players the best outdoor facilities in order to make them comfortable enough to create something bigger,"" Ashpool says. ""We want the court to become a second home. That’s how you build a community organically around a space — we simply give them the right tools."""
"The court and surrounding space, covering an area of 600 square meters, was created with NIKE GRIND, amounting to a total of 45,000 pairs of recycled sports shoes. Throughout the year, the court will host a series of exclusive opportunities for female players — including organized activity through the city's high school basketball league and adjacent community groups. All this feeds into Ashpool's belief in basketball as a unifying force and the court as the heart of a healthy, creative community."
The new Nike x Pigalle basketball court in Mexico City
"To round out 2019, Pigalle in December again joined forces with Nike to bring two refurbished basketball courts to youth in Mexico City. Located in the Juan de la Barrera Olympic Gymnasium, these newly refurbished courts will foster and empower the basketball community in the city, while offering them a safe space to enjoy sport. "
Stéphane Ashpool wears the new Nike x Pigalle apparel and the Converse x Pigalle All Star Pro BB
The latest Nike x Pigalle Collection
More of the latest Nike x Pigalle Collection
"Ashpool considers his latest Nike x Pigalle Collection to be the uniform of the program, which he calls ""the power of sport to move the world forward."" It extends his individual view on ’90s-inspired apparel in a way that is also authentic to the Pigalle community — garments equally at ease on court and on street."
"Adjacent footwear channels the past and present of basketball culture and extends Ashpool's connections across NIKE, Inc. by delivering a vibrant take on the Converse Chuck 70 and a streamlined colorway of the Converse All Star Pro BB (which debuted in Paris in summer 2019). The Chuck 70 comes in two colorways, one a play on Converse's iconic natural canvas, the other featuring a gradient scheme. Both are created with a technical fuse film atop the canvas, a design element that gives the shoes an aura of future tech and classic style. This supports Ashpool's desire to merge cultures, which also comes through in his use of Converse footwear to celebrate ""the power of music to move the world forward"" (a phrase used on the white Chuck 70's rand) and promote a holistic view of the progressive value of sport and arts. "
"The latest Nike x Pigalle Collection and the Converse x Pigalle Chuck 70 and All-Star Pro BB release globally January 25 on nike.com, converse.com and at select retailers."
.........................................................
"Kylian Mbappé’s explosive rise from Parisian schoolboy to global star is chronicled in his first Nike collection, crowned by the launch of his own Mercurial Superfly 7."
Paris Saint-Germain and French national team forward Kylian Mbappé showcases his first Nike collection. 
"In addition to the boots, the collection includes an Air Max 98, a Nike F.C. jersey, hoodie, T-shirt, hip pack, cap and a football. All are infused with the swagger Mbappé brings to the pitch and his enduring love for Bondy, the Parisian suburb he grew up in. "
"The new Bondy Dreams Mercurial Superfly combines a sleek white upper with a bold green geometric pattern that sprawls across the heel, side and front of the boot. "
The collection's Air Max 98 is topped with French flag accents.
"The color green is a prevailing theme throughout the collection. It references Bondy’s rural past, the trees on the commune’s coat of arms and the green shirts worn by AS Bondy."
The number 93 — to indicate Bondy’s location in the 93rd department (Seine-Saint-Denis) — is also heavily referenced.
The collection's football is infused with green and gold accents. 
"The collection weaves two gold stars throughout, signifying the two gold finishes by Mbappé's home country on the world's biggest football stage. "
"“Bondy is always in my heart; it’s where I found and fell in love with football,” says Mbappé. “It helped shape me as a person and as a player. I have a lot to be thankful for and it is special that Bondy is at the center of this collection. Back then I had my heroes and many of them had their own special edition Nike boot, so to join them in now having one of my own is a dream come true.”"
The Bondy Dreams Mercurial Superfly is available globally December 8 on nike.com and drops at select retailers December 11. The full Bondy Dreams collection will be sold exclusively in Europe December 8.
.........................................................
"<span class=""font--italic"">December 04, 2019 - </span>"
"December 04, 2019 - "
"Nike SB has teamed up with Oskar Rozenberg-Hallberg, better known as Oski, to introduce the skater’s first Orange Label Collection. Weaving a Swoosh shark design throughout the shoes and apparel, Oski intentionally employs the king of the ocean as a representation of mastering any skill. "
"“I’ve always been intimidated of sharks,” says Oski. “They look so brutal and they move so skillfully through the water. They are the kings of their environment in my eyes. One of my favorite animals and just really iconic looking. I feel like if you can do anything as effortless as a [shark] can swim, you’re doing it right.”"
"The Nike SB Oski Orange Label Blazer and apparel, including a jacket, hoodie, top and T-shirt, launch December 14 and the Nike SB Oski Orange Label Dunk launches December 21. The collection is available globally at local skate shops. "
"<span class=""font--italic"">April 06, 2020 - </span>"
"April 06, 2020 - "
"Neymar Jr. never stops inventing, refracting the harsh glare of the spotlight into a brilliant spectrum of athleticism. It’s those prismatic elements of Neymar Jr. that serve as the inspiration for Nike’s special edition Neymar Jr. Mercurial Vapor Jogo Prismático: a boot that is the embodiment of the player."
"A bold expression of all he brings on and off the pitch, Neymar Jr.’s latest player edition boot is packed with character. From the "
"<a class=""text--link"" href=""https://news.nike.com/news/neymar-ousadia-alegria-boots"" target=""_blank"">Ousadia (Daring) and Alegria (Joy)</a>"
Ousadia (Daring) and Alegria (Joy)
" printed on the heels of the boot corresponding to Neymar Jr.’s tattoos on his legs, to the boot's aesthetic nods to the dynamic 2019 "
"<a class=""text--link"" href=""https://news.nike.com/footwear/neymar-jr-mercurial-vapor-360-speed-freak"" target=""_blank"">Mercurial Vapor Speed Freak</a>"
Mercurial Vapor Speed Freak
", this boot weaves in elements of Neymar Jr. and Nike Football history throughout its design. Also underscoring Neymar Jr.'s longstanding relationship with Nike, this boot highlights the stars of his first Mercurial player edition — the 2017 "
"<a class=""text--link"" href=""https://news.nike.com/news/neymar-jr-written-in-the-stars-mercurial-vapor"" target=""_blank"">“Written in the Stars” Mercurial Vapor</a>"
“Written in the Stars” Mercurial Vapor
"  — hidden amongst the kaleidoscopic print. For the first time, Neymar Jr.’s latest player edition boot also employs his new NJR signature logo; the previous NJR logo is used as a secondary detail within the pattern."
The Neymar Jr. Mercurial Vapor Jogo Prismático is available April 6 on nike.com.
"<span class=""font--italic"">April 02, 2020 - </span>"
"April 02, 2020 - "
"The Jordan Brand Summer 2020 collection brings fresh takes to Jordan classics, weaving together Jumpman heritage and contemporary style. The new line offers something for everyone, including two Air Jordan V editions celebrating the silhouette’s 30"
<sup>th</sup>
th
" anniversary, a retro of the Air Jordan XIII “Flint” and new colorways of the Air Jordan XI low."
<strong>AIR JORDAN V RETRO</strong>
AIR JORDAN V RETRO
<br/>
